{
  "$schema": "../../schemas/r1-initialization-manifest.schema.json",
  "schemaVersion": "mathin-r1-initialization-v1",
  "environment": "production",
  "mode": "plan-only",
  "projectId": "example-production-project",
  "databaseId": "example-production-database",
  "migration": {
    "head": "20260907001300_arabic_grade_labels",
    "digest": "79684943c3d64490e1a1231f795818f6bd8a2f38bac16f83a2de577e801ec275",
    "fileCount": 320
  },
  "platform": {
    "source": "supabase/ci/00_platform_bootstrap.sql",
    "sourceSha256": "4ddc631ae9a3236b9e05585f79b6338abb547b2fe5cfb2e0478c544b0c2796cc",
    "scope": "ci-verification-only"
  },
  "referenceData": {
    "kind": "course_catalog",
    "source": "supabase/seed/teaching-plans.json",
    "sourceSha256": "7f4caef6fbdc1849a6ccecd678bc210bc9ce24ee2c37ebceb3bdc87ab7ed39ea",
    "familySlug": "xueersi-e-primary-math-cn",
    "naturalKey": "catalogVersion+productCode",
    "expectedCourseCount": 90,
    "expectedLectureCount": 1135,
    "naturalKeysSha256": "b4a67b81345a2a73992fb513579447ca3037245716d5d10e3ad9259b27fa856e"
  },
  "configuration": [
    {
      "kind": "organization_rules",
      "source": "supabase/migrations/20260728000100_r1_organization_settings.sql",
      "sourceSha256": "fa460d331147ea367e13dba272c6f84610325eb854551ac31d050d2df1bc6254",
      "naturalKey": "domain",
      "expectedKeys": ["calendar", "finance", "lesson", "notification", "public_publishing", "scheduling"]
    },
    {
      "kind": "feature_flags",
      "source": "supabase/migrations/20260728000100_r1_organization_settings.sql",
      "sourceSha256": "fa460d331147ea367e13dba272c6f84610325eb854551ac31d050d2df1bc6254",
      "naturalKey": "flagKey",
      "expectedKeys": ["finance.enabled", "notifications.email", "notifications.sms", "notifications.wechat", "public_content.publish"]
    }
  ],
  "administrator": {
    "manifestPath": "docs/manifests/production-admin.example.json",
    "manifestSha256": "c0e41ffa51222f7ffbe1866727d9ac8b85a1f9838fd4b335acacbbb37f83c9fa"
  },
  "generatedAt": "2026-08-25T00:00:00.000Z",
  "approvedBy": ["release-owner", "security-reviewer"]
}
